{
  "contract_id": "SF-CON-ANALYTICS-METRIC",
  "contract_status": "FROZEN",
  "freeze_status": "FROZEN",
  "tenant_id": "11111111-1111-4111-8111-111111111111",
  "metric_id": "77777777-7777-4777-8777-777777777777",
  "metric_code": "APPLICATIONS_SUBMITTED",
  "period_start": "2026-10-01T00:00:00.000Z",
  "period_end": "2026-10-08T23:59:59.000Z",
  "value": 42,
  "dimensions": {
    "jurisdiction_code": "IN-OD"
  },
  "aggregate_only": true,
  "raw_pii_payload_forbidden": true,
  "purpose_code": "OPERATIONS_MIS"
}
